category,text
departments,"SneakerZone categorías de productos: Zapatillas Deportivas - Running, basketball, training, lifestyle (marcas: Nike, Adidas, Puma, New Balance, ASICS, Jordan); Streetwear - Hoodies, camisetas, joggers, chaquetas urbanas (Supreme, Off-White, Stone Island, Palace); Accesorios - Calcetines deportivos, gorras, mochilas, riñoneras, limpiadores de zapatillas, cordones; Ediciones Limitadas - Lanzamientos exclusivos, colaboraciones especiales, sneakers retro; Calzado Casual - Zapatillas urbanas, botas, sandalias de marca; Ropa Deportiva - Conjuntos Nike Tech, Adidas Originals, camisetas de equipos."
locations_hours,"SneakerZone tiendas en Cuenca: 1) SneakerZone Mall del Río - Ubicación: Mall del Río, planta baja, Local 108; Horarios: Lunes a Domingo 10:00 AM - 9:00 PM; Servicios: Área de prueba, autenticación de sneakers, limpieza premium; Teléfono: (07) 456-7890. 2) SneakerZone Centro - Ubicación: Calle Bolívar y Sucre, esquina; Horarios: Lunes a Sábado 9:00 AM - 8:00 PM, Domingo 11:00 AM - 6:00 PM; Servicios: Personalización de zapatillas, resole service; Teléfono: (07) 456-7891. Ambas tiendas con estacionamiento gratuito y asesoría especializada."
delivery_online,"SneakerZone ofrece entrega domicilio en Cuenca y envíos nacionales. Ordena vía Instagram @sneakerzone_ec, WhatsApp +593 99 456 7890, o visita nuestras tiendas. Entrega Cuenca: GRATIS en compras sobre $80, sino $3 envío. Tiempo: 24 horas máximo. Envío nacional: Costo según destino, entrega 2-4 días hábiles vía Servientrega. Pagos: Tarjetas, transferencias, efectivo contraentrega (solo Cuenca). Tracking en tiempo real por WhatsApp. Probador virtual disponible en Instagram Stories."
warranties_support,"SneakerZone garantías y soporte: Todas las zapatillas incluyen garantía de autenticidad 100% verificada. Garantías: Sneakers originales 6 meses defectos de fábrica, Streetwear 3 meses, Accesorios 1 mes. Cambios y devoluciones: 15 días con etiquetas y caja original. Servicio post-venta: Limpieza profesional $8, protección impermeabilizante $5, cambio de cordones gratis primera vez. Soporte: En tienda, WhatsApp Lun-Sab 9AM-8PM, DM Instagram respuesta inmediata, email ventas@sneakerzone.com.ec."
promotions_financing,"SneakerZone promociones y financiamiento: Drop Fridays con hasta 30% descuento en selecciones. Descuento estudiante: 15% en streetwear con carné vigente. Programa trade-in: Cambia tus sneakers usados por crédito. Financiamiento: Cuotas sin interés 3, 6, 9 meses con tarjetas Banco Pichincha y Produbanco en compras sobre $150. Membresía VIP: Puntos por compra, acceso early a drops exclusivos. Síguenos @sneakerzone_ec para flash sales. Back to School (Enero-Marzo): Packs estudiante sneakers + mochila con descuentos especiales."
exclusive_drops,"SneakerZone drops y lanzamientos exclusivos: Somos distribuidores oficiales de lanzamientos limitados Nike SNKRS, Adidas Confirmed, Jordan releases. Pre-orders disponibles con 50% adelanto. Notificaciones VIP vía WhatsApp para drops sorpresa. Colaboraciones exclusivas: Travis Scott, Off-White x Nike, Yeezy restocks. Raffles para lanzamientos hyped con entrada gratuita en tienda. Autenticación garantizada con certificado. Sneaker calendar mensual en nuestro Instagram con todos los próximos lanzamientos. Eventos de lanzamiento con DJ, refreshments y descuentos especiales."
